{
  "$schema": "https://json-schema.org/draft/2020-12/schema",
  "title": "adonis-pi config",
  "type": "object",
  "additionalProperties": false,
  "properties": {
    "$schema": {
      "type": "string"
    },
    "agentsMd": {
      "type": "string",
      "description": "Path to the AGENTS.md that pin setup links into the account dir. Empty = not linked."
    },
    "permissionGate": {
      "type": "object",
      "additionalProperties": false,
      "properties": {
        "mode": {
          "enum": [
            "ask",
            "block",
            "off"
          ],
          "description": "ask: confirm in the UI (block when there is none); block: always block; off: gate disabled, pi runs every tool call as it does natively."
        },
        "denyCommands": {
          "type": "array",
          "items": {
            "type": "string"
          }
        },
        "protectedPaths": {
          "type": "array",
          "items": {
            "type": "string"
          }
        },
        "denyTools": {
          "type": "array",
          "items": {
            "type": "string",
            "pattern": "^mcp__(?=[A-Za-z0-9_*]*(\\*|[A-Za-z0-9]__))[A-Za-z0-9_*]+$"
          },
          "description": "Globs on MCP tool names as pi's built-in MCP Client registers them: mcp__<server>__<tool>, every character outside A-Za-z0-9_ written as _ (kimi-cu -> mcp__kimi_cu__click). * matches any run of characters. Old <server>_<tool> rules are rejected."
        }
      }
    },
    "notify": {
      "type": "object",
      "additionalProperties": false,
      "properties": {
        "command": {
          "type": "string",
          "description": "Notifier executable. Use \"$VAR\" to read from the environment."
        },
        "kinds": {
          "type": "object",
          "additionalProperties": false,
          "properties": {
            "confirm": {
              "type": "boolean"
            },
            "fail": {
              "type": "boolean"
            },
            "idle": {
              "type": "boolean"
            }
          }
        },
        "idleDelaySeconds": {
          "type": "integer",
          "minimum": 0
        }
      }
    },
    "askUserQuestion": {
      "type": "object",
      "additionalProperties": false,
      "properties": {
        "enabled": {
          "type": "boolean"
        }
      }
    }
  }
}
